Sql assignment-3

Lab Activity 1: Create a table STUDENT with under mentioned structure by using SQL  Statement: 

CREATE TABLE Student (
    StdID INT PRIMARY KEY,
    StdName VARCHAR(30) NOT NULL,
    Sex VARCHAR(6),
    Percentage DECIMAL(5,2),
    SClass INT,
    Sec VARCHAR(1),
    Stream VARCHAR(10),
    DOB DATE
);

INSERT INTO Student (StdID, StdName, Sex, Percentage, SClass, Sec, Stream, DOB) 
VALUES (1001, 'AKSHRA AGARWAL', 'FEMALE', NULL, 11, 'A', 'Science', '1996-10-11');

INSERT INTO Student (StdID, StdName, Sex, Percentage, SClass, Sec, Stream, DOB) 
VALUES (1002, 'ANJANI SHARMA', 'FEMALE', 75, 11, 'A', 'Commerce', '1996-09-18');

INSERT INTO Student (StdID, StdName, Sex, Percentage, SClass, Sec, Stream, DOB) 
VALUES (1003, 'ANSHUL SAXENA', 'MALE', 78, 11, 'A', 'Commerce', '1996-11-19');

INSERT INTO Student (StdID, StdName, Sex, Percentage, SClass, Sec, Stream, DOB) 
VALUES (1004, 'AISHWARYA SINGH', 'FEMALE', 79, 11, 'A', 'Commerce', '1996-11-01');

INSERT INTO Student (StdID, StdName, Sex, Percentage, SClass, Sec, Stream, DOB) 
VALUES (1005, 'AKRITI SAXENA', 'FEMALE', 76, 11, 'A', 'Commerce', '1996-09-20');

INSERT INTO Student (StdID, StdName, Sex, Percentage, SClass, Sec, Stream, DOB) 
VALUES (1006, 'KHUSHI AGARWAL', 'FEMALE', 77, 11, 'A', 'Commerce', '2003-09-14');

INSERT INTO Student (StdID, StdName, Sex, Percentage, SClass, Sec, Stream, DOB) 
VALUES (1007, 'MAAHI AGARWAL', 'FEMALE', 74, 11, 'A', 'Science', '1997-04-21');

INSERT INTO Student (StdID, StdName, Sex, Percentage, SClass, Sec, Stream, DOB) 
VALUES (1008, 'MITALI GUPTA', 'FEMALE', 78, 12, 'A', 'Science', '1997-11-26');

INSERT INTO Student (StdID, StdName, Sex, Percentage, SClass, Sec, Stream, DOB) 
VALUES (1009, 'NIKUNJ AGARWAL', 'MALE', 58, 12, 'A', 'Science', '1997-07-12');


INSERT INTO Student (StdID, StdName, Sex, Percentage, SClass, Sec, Stream, DOB) 
VALUES (1010, 'PARKHI', 'FEMALE', 59, 12, 'A', 'Commerce', '1997-12-20');

INSERT INTO Student (StdID, StdName, Sex, Percentage, SClass, Sec, Stream, DOB) 
VALUES (1011, 'PRAKHAR TIWARI', 'MALE', 43, 12, 'A', 'Science', '1997-04-22');


INSERT INTO Student (StdID, StdName, Sex, Percentage, SClass, Sec, Stream, DOB) 
VALUES (1012, 'RAGHAV GANGWAR', 'MALE', 58, 12, 'A', 'Commerce', '1997-12-21');

INSERT INTO Student (StdID, StdName, Sex, Percentage, SClass, Sec, Stream, DOB) 
VALUES (1013, 'SAHIL SARASWAT', 'MALE', 57, 12, 'A', 'Commerce', '1997-08-13');


INSERT INTO Student (StdID, StdName, Sex, Percentage, SClass, Sec, Stream, DOB) 
VALUES (1014, 'SWATI MISHRA', 'FEMALE', 98, 11, 'A', 'Science', '1996-08-13');

INSERT INTO Student (StdID, StdName, Sex, Percentage, SClass, Sec, Stream, DOB) 
VALUES (1015, 'HARSH AGARWAL', 'MALE', 58, 11, 'B', 'Science', '2003-08-28');


INSERT INTO Student (StdID, StdName, Sex, Percentage, SClass, Sec, Stream, DOB) 
VALUES (1016, 'HARSHIT KUMAR', 'MALE', 98, 11, 'B', 'Science', '2003-05-22');

INSERT INTO Student (StdID, StdName, Sex, Percentage, SClass, Sec, Stream, DOB) 
VALUES (1017, 'JAHANVI KAPOOR', 'MALE', 65, 11, 'B', 'Science', '1997-01-10');

INSERT INTO Student (StdID, StdName, Sex, Percentage, SClass, Sec, Stream, DOB) 
VALUES (1018, 'STUTI MISHRA', 'MALE', 66, 11, 'C', 'Commerce', '1996-01-10');

INSERT INTO Student (StdID, StdName, Sex, Percentage, SClass, Sec, Stream, DOB) 
VALUES (1019, 'SURYANSH KUMAR AGARWAL', 'MALE', 85, 11, 'C', 'Commerce', '2007-08-22');

INSERT INTO Student (StdID, StdName, Sex, Percentage, SClass, Sec, Stream, DOB) 
VALUES (1020, 'TANI RASTOGI', 'FEMALE', 75, 12, 'C', 'Commerce', '1998-01-15');

INSERT INTO Student (StdID, StdName, Sex, Percentage, SClass, Sec, Stream, DOB) 
VALUES (1021, 'TANISHK GUPTA', 'MALE', 55, 12, 'C', 'Science', '1998-04-11');


INSERT INTO Student (StdID, StdName, Sex, Percentage, SClass, Sec, Stream, DOB) 
VALUES (1022, 'TANMAY AGARWAL', 'MALE', 57, 11, 'C', 'Commerce', '1998-06-28')

INSERT INTO Student (StdID, StdName, Sex, Percentage, SClass, Sec, Stream, DOB) 
VALUES (1023, 'YASH SAXENA', 'MALE', 79, 11, 'C', 'Science', '1998-03-13');

INSERT INTO Student (StdID, StdName, Sex, Percentage, SClass, Sec, Stream, DOB) 
VALUES (1024, 'YESH DUBEY', 'MALE', 85, 12, 'C', 'Commerce', '1998-04-03');


Lab Activity 2: Open school database, then select student table and use following SQL statements. 
TYPE THE STATEMENT, PRESS ENTER AND NOTE THE OUTPUT 1 To display all the records form STUDENT table.  


mysql> select * from student;
+-------+------------------------+--------+------------+--------+------+----------+------------+
| StdID | StdName                | Sex    | Percentage | SClass | Sec  | Stream   | DOB        |
+-------+------------------------+--------+------------+--------+------+----------+------------+
|  1001 | AKSHRA AGARWAL         | FEMALE |       NULL |     11 | A    | Science  | 1996-10-11 |
|  1002 | ANJANI SHARMA          | FEMALE |      75.00 |     11 | A    | Commerce | 1996-09-18 |
|  1003 | ANSHUL SAXENA          | MALE   |      78.00 |     11 | A    | Commerce | 1996-11-19 |
|  1004 | AISHWARYA SINGH        | FEMALE |      79.00 |     11 | A    | Commerce | 1996-11-01 |
|  1005 | AKRITI SAXENA          | FEMALE |      76.00 |     11 | A    | Commerce | 1996-09-20 |
|  1006 | KHUSHI AGARWAL         | FEMALE |      77.00 |     11 | A    | Commerce | 2003-09-14 |
|  1007 | MAAHI AGARWAL          | FEMALE |      74.00 |     11 | A    | Science  | 1997-04-21 |
|  1008 | MITALI GUPTA           | FEMALE |      78.00 |     12 | A    | Science  | 1997-11-26 |
|  1009 | NIKUNJ AGARWAL         | MALE   |      58.00 |     12 | A    | Science  | 1997-07-12 |
|  1010 | PARKHI                 | FEMALE |      59.00 |     12 | A    | Commerce | 1997-12-20 |
|  1011 | PRAKHAR TIWARI         | MALE   |      43.00 |     12 | A    | Science  | 1997-04-22 |
|  1012 | RAGHAV GANGWAR         | MALE   |      58.00 |     12 | A    | Commerce | 1997-12-21 |
|  1013 | SAHIL SARASWAT         | MALE   |      57.00 |     12 | A    | Commerce | 1997-08-13 |
|  1014 | SWATI MISHRA           | FEMALE |      98.00 |     11 | A    | Science  | 1996-08-13 |
|  1015 | HARSH AGARWAL          | MALE   |      58.00 |     11 | B    | Science  | 2003-08-28 |
|  1016 | HARSHIT KUMAR          | MALE   |      98.00 |     11 | B    | Science  | 2003-05-22 |
|  1017 | JAHANVI KAPOOR         | MALE   |      65.00 |     11 | B    | Science  | 1997-01-10 |
|  1018 | STUTI MISHRA           | MALE   |      66.00 |     11 | C    | Commerce | 1996-01-10 |
|  1019 | SURYANSH KUMAR AGARWAL | MALE   |      85.00 |     11 | C    | Commerce | 2007-08-22 |
|  1020 | TANI RASTOGI           | FEMALE |      75.00 |     12 | C    | Commerce | 1998-01-15 |
|  1021 | TANISHK GUPTA          | MALE   |      55.00 |     12 | C    | Science  | 1998-04-11 |
|  1022 | TANMAY AGARWAL         | MALE   |      57.00 |     11 | C    | Commerce | 1998-06-28 |
|  1023 | YASH SAXENA            | MALE   |      79.00 |     11 | C    | Science  | 1998-03-13 |
|  1024 | YESH DUBEY             | MALE   |      85.00 |     12 | C    | Commerce | 1998-04-03 |
+-------+------------------------+--------+------------+--------+------+----------+------------+
24 rows in set (0.01 sec)

2. To display ony name and date of birth from the table STUDENT. 

+------------------------+------------+
| StdName                | DOB        |
+------------------------+------------+
| AKSHRA AGARWAL         | 1996-10-11 |
| ANJANI SHARMA          | 1996-09-18 |
| ANSHUL SAXENA          | 1996-11-19 |
| AISHWARYA SINGH        | 1996-11-01 |
| AKRITI SAXENA          | 1996-09-20 |
| KHUSHI AGARWAL         | 2003-09-14 |
| MAAHI AGARWAL          | 1997-04-21 |
| MITALI GUPTA           | 1997-11-26 |
| NIKUNJ AGARWAL         | 1997-07-12 |
| PARKHI                 | 1997-12-20 |
| PRAKHAR TIWARI         | 1997-04-22 |
| RAGHAV GANGWAR         | 1997-12-21 |
| SAHIL SARASWAT         | 1997-08-13 |
| SWATI MISHRA           | 1996-08-13 |
| HARSH AGARWAL          | 2003-08-28 |
| HARSHIT KUMAR          | 2003-05-22 |
| JAHANVI KAPOOR         | 1997-01-10 |
| STUTI MISHRA           | 1996-01-10 |
| SURYANSH KUMAR AGARWAL | 2007-08-22 |
| TANI RASTOGI           | 1998-01-15 |
| TANISHK GUPTA          | 1998-04-11 |
| TANMAY AGARWAL         | 1998-06-28 |
| YASH SAXENA            | 1998-03-13 |
| YESH DUBEY             | 1998-04-03 |
+------------------------+------------+
24 rows in set (0.00 sec)

3.To display all students record where percentage is greater of equal to 80 FROM student table.

SELECT * FROM student WHERE Percentage >= 80;

+-------+------------------------+--------+------------+--------+------+----------+------------+
| StdID | StdName                | Sex    | Percentage | SClass | Sec  | Stream   | DOB        |
+-------+------------------------+--------+------------+--------+------+----------+------------+
|  1014 | SWATI MISHRA           | FEMALE |      98.00 |     11 | A    | Science  | 1996-08-13 |
|  1016 | HARSHIT KUMAR          | MALE   |      98.00 |     11 | B    | Science  | 2003-05-22 |
|  1019 | SURYANSH KUMAR AGARWAL | MALE   |      85.00 |     11 | C    | Commerce | 2007-08-22 |
|  1024 | YESH DUBEY             | MALE   |      85.00 |     12 | C    | Commerce | 1998-04-03 |
+-------+------------------------+--------+------------+--------+------+----------+------------+
4 rows in set (0.00 sec)

4.To display student name, stream and percentage where percentage of student is more than 80  

SELECT StdName, Stream, Percentage FROM Student WHERE Percentage > 80;

+------------------------+----------+------------+
| StdName                | Stream   | Percentage |
+------------------------+----------+------------+
| SWATI MISHRA           | Science  |      98.00 |
| HARSHIT KUMAR          | Science  |      98.00 |
| SURYANSH KUMAR AGARWAL | Commerce |      85.00 |
| YESH DUBEY             | Commerce |      85.00 |
+------------------------+----------+------------+
4 rows in set (0.00 sec)

5. To display all records of science students whose percentage is more than 75 form student table.  

SELECT * FROM Student WHERE Stream = 'Science' AND Percentage > 75;

+-------+---------------+--------+------------+--------+------+---------+------------+
| StdID | StdName       | Sex    | Percentage | SClass | Sec  | Stream  | DOB        |
+-------+---------------+--------+------------+--------+------+---------+------------+
|  1008 | MITALI GUPTA  | FEMALE |      78.00 |     12 | A    | Science | 1997-11-26 |
|  1014 | SWATI MISHRA  | FEMALE |      98.00 |     11 | A    | Science | 1996-08-13 |
|  1016 | HARSHIT KUMAR | MALE   |      98.00 |     11 | B    | Science | 2003-05-22 |
|  1023 | YASH SAXENA   | MALE   |      79.00 |     11 | C    | Science | 1998-03-13 |
+-------+---------------+--------+------------+--------+------+---------+------------+
4 rows in set (0.03 sec)

Lab Activity 3: Open school database, then select student table and use following SQL statements. TYPE THE STATEMENT, PRESS ENTER AND NOTE THE OUTPUT 
1. To display the STUDENT table structure. 

DESCRIBE Student;

2. To add a column (FIELD)in the STUDENT table,for example TeacherID as VARCHAR(20);

ALTER TABLE Student ADD COLUMN TeacherID VARCHAR(20);

3. Type the statement 

 desc student;

+------------+--------------+------+-----+---------+-------+
| Field      | Type         | Null | Key | Default | Extra |
+------------+--------------+------+-----+---------+-------+
| StdID      | int          | NO   | PRI | NULL    |       |
| StdName    | varchar(30)  | NO   |     | NULL    |       |
| Sex        | varchar(6)   | YES  |     | NULL    |       |
| Percentage | decimal(5,2) | YES  |     | NULL    |       |
| SClass     | int          | YES  |     | NULL    |       |
| Sec        | varchar(1)   | YES  |     | NULL    |       |
| Stream     | varchar(10)  | YES  |     | NULL    |       |
| DOB        | date         | YES  |     | NULL    |       |
| TeacherID  | varchar(20)  | YES  |     | NULL    |       |
+------------+--------------+------+-----+---------+-------+
9 rows in set (0.00 sec)

4. Type the statement and press enter key, note the new field that you have added as TeacherID 

+-------+------------------------+--------+------------+--------+------+----------+------------+-----------+
| StdID | StdName                | Sex    | Percentage | SClass | Sec  | Stream   | DOB        | TeacherID |
+-------+------------------------+--------+------------+--------+------+----------+------------+-----------+
|  1001 | AKSHRA AGARWAL         | FEMALE |       NULL |     11 | A    | Science  | 1996-10-11 | NULL      |
|  1002 | ANJANI SHARMA          | FEMALE |      75.00 |     11 | A    | Commerce | 1996-09-18 | NULL      |
|  1003 | ANSHUL SAXENA          | MALE   |      78.00 |     11 | A    | Commerce | 1996-11-19 | NULL      |
|  1004 | AISHWARYA SINGH        | FEMALE |      79.00 |     11 | A    | Commerce | 1996-11-01 | NULL      |
|  1005 | AKRITI SAXENA          | FEMALE |      76.00 |     11 | A    | Commerce | 1996-09-20 | NULL      |
|  1006 | KHUSHI AGARWAL         | FEMALE |      77.00 |     11 | A    | Commerce | 2003-09-14 | NULL      |
|  1007 | MAAHI AGARWAL          | FEMALE |      74.00 |     11 | A    | Science  | 1997-04-21 | NULL      |
|  1008 | MITALI GUPTA           | FEMALE |      78.00 |     12 | A    | Science  | 1997-11-26 | NULL      |
|  1009 | NIKUNJ AGARWAL         | MALE   |      58.00 |     12 | A    | Science  | 1997-07-12 | NULL      |
|  1010 | PARKHI                 | FEMALE |      59.00 |     12 | A    | Commerce | 1997-12-20 | NULL      |
|  1011 | PRAKHAR TIWARI         | MALE   |      43.00 |     12 | A    | Science  | 1997-04-22 | NULL      |
|  1012 | RAGHAV GANGWAR         | MALE   |      58.00 |     12 | A    | Commerce | 1997-12-21 | NULL      |
|  1013 | SAHIL SARASWAT         | MALE   |      57.00 |     12 | A    | Commerce | 1997-08-13 | NULL      |
|  1014 | SWATI MISHRA           | FEMALE |      98.00 |     11 | A    | Science  | 1996-08-13 | NULL      |
|  1015 | HARSH AGARWAL          | MALE   |      58.00 |     11 | B    | Science  | 2003-08-28 | NULL      |
|  1016 | HARSHIT KUMAR          | MALE   |      98.00 |     11 | B    | Science  | 2003-05-22 | NULL      |
|  1017 | JAHANVI KAPOOR         | MALE   |      65.00 |     11 | B    | Science  | 1997-01-10 | NULL      |
|  1018 | STUTI MISHRA           | MALE   |      66.00 |     11 | C    | Commerce | 1996-01-10 | NULL      |
|  1019 | SURYANSH KUMAR AGARWAL | MALE   |      85.00 |     11 | C    | Commerce | 2007-08-22 | NULL      |
|  1020 | TANI RASTOGI           | FEMALE |      75.00 |     12 | C    | Commerce | 1998-01-15 | NULL      |
|  1021 | TANISHK GUPTA          | MALE   |      55.00 |     12 | C    | Science  | 1998-04-11 | NULL      |
|  1022 | TANMAY AGARWAL         | MALE   |      57.00 |     11 | C    | Commerce | 1998-06-28 | NULL      |
|  1023 | YASH SAXENA            | MALE   |      79.00 |     11 | C    | Science  | 1998-03-13 | NULL      |
|  1024 | YESH DUBEY             | MALE   |      85.00 |     12 | C    | Commerce | 1998-04-03 | NULL      |
+-------+------------------------+--------+------------+--------+------+----------+------------+-----------+
24 rows in set (0.00 sec)

5. To modify the TeacherID data type form character to integer. 

ALTER TABLE Student MODIFY TeacherID INTEGER ;  
 
DESC Student;
+------------+--------------+------+-----+---------+-------+
| Field      | Type         | Null | Key | Default | Extra |
+------------+--------------+------+-----+---------+-------+
| StdID      | int          | NO   | PRI | NULL    |       |
| StdName    | varchar(30)  | NO   |     | NULL    |       |
| Sex        | varchar(10)  | YES  |     | NULL    |       |
| Percentage | decimal(5,2) | YES  |     | NULL    |       |
| SClass     | int          | YES  |     | NULL    |       |
| Sec        | varchar(1)   | YES  |     | NULL    |       |
| Stream     | varchar(10)  | YES  |     | NULL    |       |
| DOB        | date         | YES  |     | NULL    |       |
| TeacherID  | int          | YES  |     | NULL    |       |
+------------+--------------+------+-----+---------+-------+


 select * from student;
+-------+------------------------+--------+------------+--------+------+----------+------------+-----------+
| StdID | StdName                | Sex    | Percentage | SClass | Sec  | Stream   | DOB        | TeacherID |
+-------+------------------------+--------+------------+--------+------+----------+------------+-----------+
|  1001 | AKSHRA AGARWAL         | FEMALE |       NULL |     11 | A    | Science  | 1996-10-11 |      NULL |
|  1002 | ANJANI SHARMA          | FEMALE |      75.00 |     11 | A    | Commerce | 1996-09-18 |      NULL |
|  1003 | ANSHUL SAXENA          | MALE   |      78.00 |     11 | A    | Commerce | 1996-11-19 |      NULL |
|  1004 | AISHWARYA SINGH        | FEMALE |      79.00 |     11 | A    | Commerce | 1996-11-01 |      NULL |
|  1005 | AKRITI SAXENA          | FEMALE |      76.00 |     11 | A    | Commerce | 1996-09-20 |      NULL |
|  1006 | KHUSHI AGARWAL         | FEMALE |      77.00 |     11 | A    | Commerce | 2003-09-14 |      NULL |
|  1007 | MAAHI AGARWAL          | FEMALE |      74.00 |     11 | A    | Science  | 1997-04-21 |      NULL |
|  1008 | MITALI GUPTA           | FEMALE |      78.00 |     12 | A    | Science  | 1997-11-26 |      NULL |
|  1009 | NIKUNJ AGARWAL         | MALE   |      58.00 |     12 | A    | Science  | 1997-07-12 |      NULL |
|  1010 | PARKHI                 | FEMALE |      59.00 |     12 | A    | Commerce | 1997-12-20 |      NULL |
|  1011 | PRAKHAR TIWARI         | MALE   |      43.00 |     12 | A    | Science  | 1997-04-22 |      NULL |
|  1012 | RAGHAV GANGWAR         | MALE   |      58.00 |     12 | A    | Commerce | 1997-12-21 |      NULL |
|  1013 | SAHIL SARASWAT         | MALE   |      57.00 |     12 | A    | Commerce | 1997-08-13 |      NULL |
|  1014 | SWATI MISHRA           | FEMALE |      98.00 |     11 | A    | Science  | 1996-08-13 |      NULL |
|  1015 | HARSH AGARWAL          | MALE   |      58.00 |     11 | B    | Science  | 2003-08-28 |      NULL |
|  1016 | HARSHIT KUMAR          | MALE   |      98.00 |     11 | B    | Science  | 2003-05-22 |      NULL |
|  1017 | JAHANVI KAPOOR         | MALE   |      65.00 |     11 | B    | Science  | 1997-01-10 |      NULL |
|  1018 | STUTI MISHRA           | MALE   |      66.00 |     11 | C    | Commerce | 1996-01-10 |      NULL |
|  1019 | SURYANSH KUMAR AGARWAL | MALE   |      85.00 |     11 | C    | Commerce | 2007-08-22 |      NULL |
|  1020 | TANI RASTOGI           | FEMALE |      75.00 |     12 | C    | Commerce | 1998-01-15 |      NULL |
|  1021 | TANISHK GUPTA          | MALE   |      55.00 |     12 | C    | Science  | 1998-04-11 |      NULL |
|  1022 | TANMAY AGARWAL         | MALE   |      57.00 |     11 | C    | Commerce | 1998-06-28 |      NULL |
|  1023 | YASH SAXENA            | MALE   |      79.00 |     11 | C    | Science  | 1998-03-13 |      NULL |
|  1024 | YESH DUBEY             | MALE   |      85.00 |     12 | C    | Commerce | 1998-04-03 |      NULL |
+-------+------------------------+--------+------------+--------+------+----------+------------+-----------+
24 rows in set (0.00 sec)

Lab Activity 4 
1. To Drop (Delete) a field form a table. For e.g you wantto delete TeacherID field.
ALTER TABLE Student DROP TeacherID;

 desc student;
+------------+--------------+------+-----+---------+-------+
| Field      | Type         | Null | Key | Default | Extra |
+------------+--------------+------+-----+---------+-------+
| StdID      | int          | NO   | PRI | NULL    |       |
| StdName    | varchar(30)  | NO   |     | NULL    |       |
| Sex        | varchar(6)   | YES  |     | NULL    |       |
| Percentage | decimal(5,2) | YES  |     | NULL    |       |
| SClass     | int          | YES  |     | NULL    |       |
| Sec        | varchar(1)   | YES  |     | NULL    |       |
| Stream     | varchar(10)  | YES  |     | NULL    |       |
| DOB        | date         | YES  |     | NULL    |       |
+------------+--------------+------+-----+---------+-------+
8 rows in set (0.00 sec)

2. To subtract 5 form all students percentage and display name and percentage.

 SELECT StdName, percentage - 5 FROM Student;
+------------------------+----------------+
| StdName                | percentage - 5 |
+------------------------+----------------+
| AKSHRA AGARWAL         |           NULL |
| ANJANI SHARMA          |          70.00 |
| ANSHUL SAXENA          |          73.00 |
| AISHWARYA SINGH        |          74.00 |
| AKRITI SAXENA          |          71.00 |
| KHUSHI AGARWAL         |          72.00 |
| MAAHI AGARWAL          |          69.00 |
| MITALI GUPTA           |          73.00 |
| NIKUNJ AGARWAL         |          53.00 |
| PARKHI                 |          54.00 |
| PRAKHAR TIWARI         |          38.00 |
| RAGHAV GANGWAR         |          53.00 |
| SAHIL SARASWAT         |          52.00 |
| SWATI MISHRA           |          93.00 |
| HARSH AGARWAL          |          53.00 |
| HARSHIT KUMAR          |          93.00 |
| JAHANVI KAPOOR         |          60.00 |
| STUTI MISHRA           |          61.00 |
| SURYANSH KUMAR AGARWAL |          80.00 |
| TANI RASTOGI           |          70.00 |
| TANISHK GUPTA          |          50.00 |
| TANMAY AGARWAL         |          52.00 |
| YASH SAXENA            |          74.00 |
| YESH DUBEY             |          80.00 |
+------------------------+----------------+
24 rows in set (0.03 sec)

3. Using column alise for example we wantto display StdName as Student Name and DOB as Date of Birth  then the statement will be. 

SELECT StdName AS "Student Name",
    -> DOB As "Date of Birth" FROM Student;
+------------------------+---------------+
| Student Name           | Date of Birth |
+------------------------+---------------+
| AKSHRA AGARWAL         | 1996-10-11    |
| ANJANI SHARMA          | 1996-09-18    |
| ANSHUL SAXENA          | 1996-11-19    |
| AISHWARYA SINGH        | 1996-11-01    |
| AKRITI SAXENA          | 1996-09-20    |
| KHUSHI AGARWAL         | 2003-09-14    |
| MAAHI AGARWAL          | 1997-04-21    |
| MITALI GUPTA           | 1997-11-26    |
| NIKUNJ AGARWAL         | 1997-07-12    |
| PARKHI                 | 1997-12-20    |
| PRAKHAR TIWARI         | 1997-04-22    |
| RAGHAV GANGWAR         | 1997-12-21    |
| SAHIL SARASWAT         | 1997-08-13    |
| SWATI MISHRA           | 1996-08-13    |
| HARSH AGARWAL          | 2003-08-28    |
| HARSHIT KUMAR          | 2003-05-22    |
| JAHANVI KAPOOR         | 1997-01-10    |
| STUTI MISHRA           | 1996-01-10    |
| SURYANSH KUMAR AGARWAL | 2007-08-22    |
| TANI RASTOGI           | 1998-01-15    |
| TANISHK GUPTA          | 1998-04-11    |
| TANMAY AGARWAL         | 1998-06-28    |
| YASH SAXENA            | 1998-03-13    |
| YESH DUBEY             | 1998-04-03    |
+------------------------+---------------+
24 rows in set (0.08 sec)

4. Display the name of all students whose stream is not Science 

 SELECT StdName FROM student WHERE Stream <> 'Science';
+------------------------+
| StdName                |
+------------------------+
| ANJANI SHARMA          |
| ANSHUL SAXENA          |
| AISHWARYA SINGH        |
| AKRITI SAXENA          |
| KHUSHI AGARWAL         |
| PARKHI                 |
| RAGHAV GANGWAR         |
| SAHIL SARASWAT         |
| STUTI MISHRA           |
| SURYANSH KUMAR AGARWAL |
| TANI RASTOGI           |
| TANMAY AGARWAL         |
| YESH DUBEY             |
+------------------------+
13 rows in set (0.04 sec)

5. Display all name and percentage where percentage is between 60 and 80 

 SELECT StdName, percentage FROM student WHERE percentage >=60 AND percentage<=80 ;
+-----------------+------------+
| StdName         | percentage |
+-----------------+------------+
| ANJANI SHARMA   |      75.00 |
| ANSHUL SAXENA   |      78.00 |
| AISHWARYA SINGH |      79.00 |
| AKRITI SAXENA   |      76.00 |
| KHUSHI AGARWAL  |      77.00 |
| MAAHI AGARWAL   |      74.00 |
| MITALI GUPTA    |      78.00 |
| JAHANVI KAPOOR  |      65.00 |
| STUTI MISHRA    |      66.00 |
| TANI RASTOGI    |      75.00 |
| YASH SAXENA     |      79.00 |
+-----------------+------------+
11 rows in set (0.00 sec)

Lab Activity 5: 
1. TochangeastudentnamefromSWATIMISHRAtoSWATIVERMAwhoseStdIDis1014andalsochange  percentage 86.
UPDATE Student SET StdName = 'SWATI VERMA', percentage = 86 WHERE StdId = 1014;
 
 select * from student;
+-------+------------------------+--------+------------+--------+------+----------+------------+
| StdID | StdName                | Sex    | Percentage | SClass | Sec  | Stream   | DOB        |
+-------+------------------------+--------+------------+--------+------+----------+------------+
|  1001 | AKSHRA AGARWAL         | FEMALE |       NULL |     11 | A    | Science  | 1996-10-11 |
|  1002 | ANJANI SHARMA          | FEMALE |      75.00 |     11 | A    | Commerce | 1996-09-18 |
|  1003 | ANSHUL SAXENA          | MALE   |      78.00 |     11 | A    | Commerce | 1996-11-19 |
|  1004 | AISHWARYA SINGH        | FEMALE |      79.00 |     11 | A    | Commerce | 1996-11-01 |
|  1005 | AKRITI SAXENA          | FEMALE |      76.00 |     11 | A    | Commerce | 1996-09-20 |
|  1006 | KHUSHI AGARWAL         | FEMALE |      77.00 |     11 | A    | Commerce | 2003-09-14 |
|  1007 | MAAHI AGARWAL          | FEMALE |      74.00 |     11 | A    | Science  | 1997-04-21 |
|  1008 | MITALI GUPTA           | FEMALE |      78.00 |     12 | A    | Science  | 1997-11-26 |
|  1009 | NIKUNJ AGARWAL         | MALE   |      58.00 |     12 | A    | Science  | 1997-07-12 |
|  1010 | PARKHI                 | FEMALE |      59.00 |     12 | A    | Commerce | 1997-12-20 |
|  1011 | PRAKHAR TIWARI         | MALE   |      43.00 |     12 | A    | Science  | 1997-04-22 |
|  1012 | RAGHAV GANGWAR         | MALE   |      58.00 |     12 | A    | Commerce | 1997-12-21 |
|  1013 | SAHIL SARASWAT         | MALE   |      57.00 |     12 | A    | Commerce | 1997-08-13 |
|  1014 | SWATI VERMA            | FEMALE |      86.00 |     11 | A    | Science  | 1996-08-13 |
|  1015 | HARSH AGARWAL          | MALE   |      58.00 |     11 | B    | Science  | 2003-08-28 |
|  1016 | HARSHIT KUMAR          | MALE   |      98.00 |     11 | B    | Science  | 2003-05-22 |
|  1017 | JAHANVI KAPOOR         | MALE   |      65.00 |     11 | B    | Science  | 1997-01-10 |
|  1018 | STUTI MISHRA           | MALE   |      66.00 |     11 | C    | Commerce | 1996-01-10 |
|  1019 | SURYANSH KUMAR AGARWAL | MALE   |      85.00 |     11 | C    | Commerce | 2007-08-22 |
|  1020 | TANI RASTOGI           | FEMALE |      75.00 |     12 | C    | Commerce | 1998-01-15 |
|  1021 | TANISHK GUPTA          | MALE   |      55.00 |     12 | C    | Science  | 1998-04-11 |
|  1022 | TANMAY AGARWAL         | MALE   |      57.00 |     11 | C    | Commerce | 1998-06-28 |
|  1023 | YASH SAXENA            | MALE   |      79.00 |     11 | C    | Science  | 1998-03-13 |
|  1024 | YESH DUBEY             | MALE   |      85.00 |     12 | C    | Commerce | 1998-04-03 |
+-------+------------------------+--------+------------+--------+------+----------+------------+
24 rows in set (0.00 sec)

2. To delete the records form student table where StdId is 1016. 
DELETE FROM Student WHERE StdID = 1016; 

+-------+------------------------+--------+------------+--------+------+----------+------------+
| StdID | StdName                | Sex    | Percentage | SClass | Sec  | Stream   | DOB        |
+-------+------------------------+--------+------------+--------+------+----------+------------+
|  1001 | AKSHRA AGARWAL         | FEMALE |       NULL |     11 | A    | Science  | 1996-10-11 |
|  1002 | ANJANI SHARMA          | FEMALE |      75.00 |     11 | A    | Commerce | 1996-09-18 |
|  1003 | ANSHUL SAXENA          | MALE   |      78.00 |     11 | A    | Commerce | 1996-11-19 |
|  1004 | AISHWARYA SINGH        | FEMALE |      79.00 |     11 | A    | Commerce | 1996-11-01 |
|  1005 | AKRITI SAXENA          | FEMALE |      76.00 |     11 | A    | Commerce | 1996-09-20 |
|  1006 | KHUSHI AGARWAL         | FEMALE |      77.00 |     11 | A    | Commerce | 2003-09-14 |
|  1007 | MAAHI AGARWAL          | FEMALE |      74.00 |     11 | A    | Science  | 1997-04-21 |
|  1008 | MITALI GUPTA           | FEMALE |      78.00 |     12 | A    | Science  | 1997-11-26 |
|  1009 | NIKUNJ AGARWAL         | MALE   |      58.00 |     12 | A    | Science  | 1997-07-12 |
|  1010 | PARKHI                 | FEMALE |      59.00 |     12 | A    | Commerce | 1997-12-20 |
|  1011 | PRAKHAR TIWARI         | MALE   |      43.00 |     12 | A    | Science  | 1997-04-22 |
|  1012 | RAGHAV GANGWAR         | MALE   |      58.00 |     12 | A    | Commerce | 1997-12-21 |
|  1013 | SAHIL SARASWAT         | MALE   |      57.00 |     12 | A    | Commerce | 1997-08-13 |
|  1014 | SWATI VERMA            | FEMALE |      86.00 |     11 | A    | Science  | 1996-08-13 |
|  1015 | HARSH AGARWAL          | MALE   |      58.00 |     11 | B    | Science  | 2003-08-28 |
|  1017 | JAHANVI KAPOOR         | MALE   |      65.00 |     11 | B    | Science  | 1997-01-10 |
|  1018 | STUTI MISHRA           | MALE   |      66.00 |     11 | C    | Commerce | 1996-01-10 |
|  1019 | SURYANSH KUMAR AGARWAL | MALE   |      85.00 |     11 | C    | Commerce | 2007-08-22 |
|  1020 | TANI RASTOGI           | FEMALE |      75.00 |     12 | C    | Commerce | 1998-01-15 |
|  1021 | TANISHK GUPTA          | MALE   |      55.00 |     12 | C    | Science  | 1998-04-11 |
|  1022 | TANMAY AGARWAL         | MALE   |      57.00 |     11 | C    | Commerce | 1998-06-28 |
|  1023 | YASH SAXENA            | MALE   |      79.00 |     11 | C    | Science  | 1998-03-13 |
|  1024 | YESH DUBEY             | MALE   |      85.00 |     12 | C    | Commerce | 1998-04-03 |
+-------+------------------------+--------+------------+--------+------+----------+------------+
23 rows in set (0.00 sec)

3. Type the following SQL statement and note the output.
mysql> SELECT * FROM Student WHERE StdName LIKE 'G_' ;
Empty set (0.01 sec)

SELECT * FROM Student WHERE StdName='G';
Empty set (0.00 sec)

SELECT * FROM Student WHERE StdName LIKE 'G%' ;
Empty set (0.00 sec) 

SELECT * from Student WHERE StdName='%G%' ;
Empty set (0.00 sec)

 SELECT * from Student WHERE StdName like '%G%' ;
+-------+------------------------+--------+------------+--------+------+----------+------------+
| StdID | StdName                | Sex    | Percentage | SClass | Sec  | Stream   | DOB        |
+-------+------------------------+--------+------------+--------+------+----------+------------+
|  1001 | AKSHRA AGARWAL         | FEMALE |       NULL |     11 | A    | Science  | 1996-10-11 |
|  1004 | AISHWARYA SINGH        | FEMALE |      79.00 |     11 | A    | Commerce | 1996-11-01 |
|  1006 | KHUSHI AGARWAL         | FEMALE |      77.00 |     11 | A    | Commerce | 2003-09-14 |
|  1007 | MAAHI AGARWAL          | FEMALE |      74.00 |     11 | A    | Science  | 1997-04-21 |
|  1008 | MITALI GUPTA           | FEMALE |      78.00 |     12 | A    | Science  | 1997-11-26 |
|  1009 | NIKUNJ AGARWAL         | MALE   |      58.00 |     12 | A    | Science  | 1997-07-12 |
|  1012 | RAGHAV GANGWAR         | MALE   |      58.00 |     12 | A    | Commerce | 1997-12-21 |
|  1015 | HARSH AGARWAL          | MALE   |      58.00 |     11 | B    | Science  | 2003-08-28 |
|  1019 | SURYANSH KUMAR AGARWAL | MALE   |      85.00 |     11 | C    | Commerce | 2007-08-22 |
|  1020 | TANI RASTOGI           | FEMALE |      75.00 |     12 | C    | Commerce | 1998-01-15 |
|  1021 | TANISHK GUPTA          | MALE   |      55.00 |     12 | C    | Science  | 1998-04-11 |
|  1022 | TANMAY AGARWAL         | MALE   |      57.00 |     11 | C    | Commerce | 1998-06-28 |
+-------+------------------------+--------+------------+--------+------+----------+------------+
12 rows in set (0.00 sec)

Do Yourself

Create a Table Empl to store employee details as shown below and write statements  for following queries based on the table. 
 
CREATE TABLE Empl ( 
empno INT(4) PRIMARY KEY, ename VARCHAR(30) NOT NULL, Job VARCHAR(20), mgr INT ,hiredate DATE, Sal DECIMAL(7,2),comm DECIMAL(7,2), deptno INT); 


INSERT INTO Empl(empno , ename , Job , mgr , hireDate , Sal , comm , deptno ) VALUES 
(8369, 'SMITH' , 'CLERK' , 8902 , '1990-12-18' , 800 , NULL , 20),
(8499, 'ANYA' , 'SALESMAN' , 8698 , '1991-02-20' , 1600 , 300 , 30),
(8521, 'SETH' , 'SALESMAN' , 8698 , '1991-02-22' , 1250 , 500 , 30),
(8566, 'MAHADEVAN' , 'MANAGER' , 8839 , '1991-04-02' , 2985 , NULL , 20),
(8654, 'MOMIN' , 'SALESMAN' , 8698 , '1991-09-28' , 1250 , 1400 , 30),
(8698, 'BINA' , 'MANAGER' , 8839 , '1991-05-01' , 2850 , NULL , 30),
(8882, 'SHIVANSH' , 'MANAGER' , 8839 , '1991-06-09' , 2450 , NULL , 10),
(8888, 'SCOTT' , 'ANALYST' , 8566 , '1992-12-09' , 3000 , NULL , 20),
(8839, 'AMIR' , 'PRESIDENT' , NULL , '1991-11-18' , 5000 , NULL , 10),
(8844, 'KULDEEP' , 'SALESMAN' , 8698 , '1991-09-08' , 1500 , 0 , 30);


1. Consider the Empl table and write SQL command to get the following. 

a. Write a query to display EName and Sal of employees whose salary are greater than  or equal to 2200? 

Select ename as EName ,sal as Sal from empl where sal >= 2200;
+-----------+---------+
| EName     | Sal     |
+-----------+---------+
| MAHADEVAN | 2985.00 |
| BINA      | 2850.00 |
| AMIR      | 5000.00 |
| SHIVANSH  | 2450.00 |
| SCOTT     | 3000.00 |
+-----------+---------+


b. Write a query to display details of employs who are not getting commission? 

Select * from empl where comm is null;
+-------+-----------+-----------+------+------------+---------+------+--------+
| empno | ename     | Job       | mgr  | hiredate   | Sal     | comm | deptno |
+-------+-----------+-----------+------+------------+---------+------+--------+
|  8369 | SMITH     | CLERK     | 8902 | 1990-12-18 |  800.00 | NULL |     20 |
|  8566 | MAHADEVAN | MANAGER   | 8839 | 1991-04-02 | 2985.00 | NULL |     20 |
|  8698 | BINA      | MANAGER   | 8839 | 1991-05-01 | 2850.00 | NULL |     30 |
|  8839 | AMIR      | PRESIDENT | NULL | 1991-11-18 | 5000.00 | NULL |     10 |
|  8882 | SHIVANSH  | MANAGER   | 8839 | 1991-06-09 | 2450.00 | NULL |     10 |
|  8888 | SCOTT     | ANALYST   | 8566 | 1992-12-09 | 3000.00 | NULL |     20 |
+-------+-----------+-----------+------+------------+---------+------+--------+


c. Write a query to display employee name and salary of those employees who don’t have  their salary in range of 2500 to 4000? 

select ename as EmployeeName , sal as Salary from empl where sal < 2500 or sal > 4000;
+--------------+---------+
| EmployeeName | Salary  |
+--------------+---------+
| SMITH        |  800.00 |
| ANYA         | 1600.00 |
| SETH         | 1250.00 |
| MOMIN        | 1250.00 |
| AMIR         | 5000.00 |
| KULDEEP      | 1500.00 |
| SHIVANSH     | 2450.00 |
+--------------+---------+


d. Write a query to display the name, job title and salary of employees who don’t have manager? 

select ename as name,Job as job_title,sal as salary from empl where mgr is null;
+------+-----------+---------+
| name | job_title | salary  |
+------+-----------+---------+
| AMIR | PRESIDENT | 5000.00 |
+------+-----------+---------+


e. Write a query to display the name of employee whose name contains “A” as third alphabet? 

select ename as name from empl where ename like "__A%";
Empty set, 1 warning (0.12 sec)


f. Write a query to display the name of employee whose name contains “T” as last alphabet?

 select ename as name from empl where ename like "%T";
+-------+
| name  |
+-------+
| SCOTT |
+-------+


g. Write a query to display the name of employee whose name contains ”M” as First and  “L” as third alphabet? 

select ename as name from empl where ename like "M_L%";
Empty set (0.00 sec)


h. Write a query to display details of employs with the text “Not given”, if commission is null?

ALTER TABLE Empl MODIFY comm VARCHAR(255);
Query OK, 10 rows affected (0.28 sec)

desc empl;
+----------+--------------+------+-----+---------+-------+
| Field    | Type         | Null | Key | Default | Extra |
+----------+--------------+------+-----+---------+-------+
| empno    | int          | NO   | PRI | NULL    |       |
| ename    | varchar(30)  | NO   |     | NULL    |       |
| Job      | varchar(20)  | YES  |     | NULL    |       |
| mgr      | int          | YES  |     | NULL    |       |
| hiredate | date         | YES  |     | NULL    |       |
| Sal      | decimal(7,2) | YES  |     | NULL    |       |
| comm     | varchar(255) | YES  |     | NULL    |       |
| deptno   | int          | YES  |     | NULL    |       |
+----------+--------------+------+-----+---------+-------+


UPDATE Empl SET comm = "Not Given" WHERE comm is null; 

select * from empl;
+-------+-----------+-----------+------+------------+---------+-----------+--------+
| empno | ename     | Job       | mgr  | hiredate   | Sal     | comm      | deptno |
+-------+-----------+-----------+------+------------+---------+-----------+--------+
|  8369 | SMITH     | CLERK     | 8902 | 1990-12-18 |  800.00 | Not Given |     20 |
|  8499 | ANYA      | SALESMAN  | 8698 | 1991-02-20 | 1600.00 | 300.00    |     30 |
|  8521 | SETH      | SALESMAN  | 8698 | 1991-02-22 | 1250.00 | 500.00    |     30 |
|  8566 | MAHADEVAN | MANAGER   | 8839 | 1991-04-02 | 2985.00 | Not Given |     20 |
|  8654 | MOMIN     | SALESMAN  | 8698 | 1991-09-28 | 1250.00 | 1400.00   |     30 |
|  8698 | BINA      | MANAGER   | 8839 | 1991-05-01 | 2850.00 | Not Given |     30 |
|  8839 | AMIR      | PRESIDENT | NULL | 1991-11-18 | 5000.00 | Not Given |     10 |
|  8844 | KULDEEP   | SALESMAN  | 8698 | 1991-09-08 | 1500.00 | 0.00      |     30 |
|  8882 | SHIVANSH  | MANAGER   | 8839 | 1991-06-09 | 2450.00 | Not Given |     10 |
|  8888 | SCOTT     | ANALYST   | 8566 | 1992-12-09 | 3000.00 | Not Given |     20 |
+-------+-----------+-----------+------+------------+---------+-----------+--------+
